{
  "version": 1,
  "demo_password": "ArtsDemo-2026!",
  "team": {
    "id": 1,
    "name": "云栖昆曲艺术团"
  },
  "teams": [
    {
      "id": 1,
      "name": "云栖昆曲艺术团"
    },
    {
      "id": 2,
      "name": "海棠越剧工作室"
    },
    {
      "id": 3,
      "name": "松风实验剧团"
    }
  ],
  "users": [
    {
      "id": 11,
      "team_id": 1,
      "role": "owner",
      "name": "周清和",
      "email": "qinghe@yunxi.example"
    },
    {
      "id": 12,
      "team_id": 1,
      "role": "editor",
      "name": "林知夏",
      "email": "zhixia@yunxi.example"
    },
    {
      "id": 13,
      "team_id": 1,
      "role": "viewer",
      "name": "陈予安",
      "email": "yuan@yunxi.example"
    },
    {
      "id": 14,
      "team_id": 2,
      "role": "owner",
      "name": "沈若棠",
      "email": "ruotang@haitang.example"
    },
    {
      "id": 15,
      "team_id": 2,
      "role": "editor",
      "name": "顾南音",
      "email": "nanyin@haitang.example"
    },
    {
      "id": 16,
      "team_id": 2,
      "role": "viewer",
      "name": "许闻溪",
      "email": "wenxi@haitang.example"
    },
    {
      "id": 17,
      "team_id": 3,
      "role": "owner",
      "name": "陆青岚",
      "email": "qinglan@songfeng.example"
    },
    {
      "id": 18,
      "team_id": 3,
      "role": "editor",
      "name": "唐月白",
      "email": "yuebai@songfeng.example"
    },
    {
      "id": 19,
      "team_id": 3,
      "role": "viewer",
      "name": "叶知秋",
      "email": "zhiqiu@songfeng.example"
    }
  ],
  "performances": [
    {
      "id": "762e8d66-b228-5282-a757-16a0b58fbcd1",
      "team_id": 1,
      "title": "《牡丹亭·游园》秋日专场",
      "venue": "苏州昆剧院小剧场",
      "starts_at": "2026-10-25T19:30:00",
      "booking_status": "已确认",
      "owner_email": "qinghe@yunxi.example",
      "notes": "演出及宣发档期已与场地方确认。"
    },
    {
      "id": "4c667491-4d6a-55db-b04b-d40cbc37b86a",
      "team_id": 2,
      "title": "《梁祝·十八相送》青年版",
      "venue": "海棠艺术中心",
      "starts_at": "2026-10-27T19:30:00",
      "booking_status": "已确认",
      "owner_email": "nanyin@haitang.example",
      "notes": "演出及宣发档期已与场地方确认。"
    },
    {
      "id": "c5e1b138-7096-59e2-a0db-1b92f85f9c41",
      "team_id": 3,
      "title": "《长生殿·惊变》沉浸演出",
      "venue": "松风黑匣子",
      "starts_at": "2026-10-29T19:30:00",
      "booking_status": "已确认",
      "owner_email": "qinglan@songfeng.example",
      "notes": "演出及宣发档期已与场地方确认。"
    },
    {
      "id": "5bf53b1d-9535-52ea-833c-8fd1c1c54704",
      "team_id": 1,
      "title": "水袖与身段周末公开课",
      "venue": "云栖排练厅",
      "starts_at": "2026-10-31T19:30:00",
      "booking_status": "已确认",
      "owner_email": "zhixia@yunxi.example",
      "notes": "演出及宣发档期已与场地方确认。"
    },
    {
      "id": "c560bd63-f7ce-5644-913b-124ac27a5884",
      "team_id": 2,
      "title": "越音新声青年折子戏",
      "venue": "海棠实验剧场",
      "starts_at": "2026-11-02T19:30:00",
      "booking_status": "已确认",
      "owner_email": "ruotang@haitang.example",
      "notes": "演出及宣发档期已与场地方确认。"
    },
    {
      "id": "3deb2ca4-7f6e-586f-9b52-bdce5514dece",
      "team_id": 3,
      "title": "《玉簪记·琴挑》午后场",
      "venue": "松风艺文空间",
      "starts_at": "2026-11-04T19:30:00",
      "booking_status": "已确认",
      "owner_email": "yuebai@songfeng.example",
      "notes": "演出及宣发档期已与场地方确认。"
    },
    {
      "id": "641e1f4f-2315-5f39-9d9e-08cdf7d9e437",
      "team_id": 1,
      "title": "后台开放日：一台戏的诞生",
      "venue": "云栖排练厅",
      "starts_at": "2026-11-06T19:30:00",
      "booking_status": "已确认",
      "owner_email": "qinghe@yunxi.example",
      "notes": "演出及宣发档期已与场地方确认。"
    },
    {
      "id": "1e21a723-8bee-5da8-b8f9-c7e4119db391",
      "team_id": 2,
      "title": "传统戏曲唱腔赏析会",
      "venue": "海棠艺术中心",
      "starts_at": "2026-11-08T19:30:00",
      "booking_status": "已确认",
      "owner_email": "nanyin@haitang.example",
      "notes": "演出及宣发档期已与场地方确认。"
    },
    {
      "id": "04d702f1-02a9-58ab-bdfc-6d932e0e2ada",
      "team_id": 3,
      "title": "新编小戏《灯影》首演",
      "venue": "松风黑匣子",
      "starts_at": "2026-11-10T19:30:00",
      "booking_status": "已确认",
      "owner_email": "qinglan@songfeng.example",
      "notes": "演出及宣发档期已与场地方确认。"
    }
  ],
  "contents": [
    {
      "id": "2a87c2bb-a862-538b-a759-9cd8616b01f6",
      "team_id": 1,
      "title": "秋日特别策划｜从后台第一盏工作灯亮起，到《牡丹亭·游园》谢幕后观众回望与青年演员复盘的完整记录",
      "category": "演出宣传",
      "platform": "抖音",
      "published_at": "2026-10-12T19:30:00",
      "duration": 34,
      "views": 0,
      "likes": 0,
      "comments": 0,
      "saves": 0,
      "shares": 0,
      "completion": 0,
      "lifecycle": "未发布",
      "workflow_state": "待制作",
      "performance_id": "762e8d66-b228-5282-a757-16a0b58fbcd1",
      "owner_email": "qinghe@yunxi.example",
      "tags": [],
      "materials": "灯光定妆照、后台花絮短片、演员授权肖像素材",
      "cover_url": "",
      "notes": ""
    },
    {
      "id": "24ab1d35-2101-5dcf-b8a5-5d68125aeb4e",
      "team_id": 2,
      "title": "演员妆造从净面到点翠的四十分钟｜梁祝·十八相送青年版",
      "category": "技艺展示",
      "platform": "小红书",
      "published_at": "2026-10-13T19:30:00",
      "duration": 41,
      "views": 0,
      "likes": 0,
      "comments": 0,
      "saves": 0,
      "shares": 0,
      "completion": 0,
      "lifecycle": "未发布",
      "workflow_state": "待制作",
      "performance_id": "4c667491-4d6a-55db-b04b-d40cbc37b86a",
      "owner_email": "ruotang@haitang.example",
      "tags": [
        "后台",
        "妆造",
        "舞台日记"
      ],
      "materials": "",
      "cover_url": "example/covers/arts-2.jpg",
      "notes": "演出团队确认素材授权；镜头包含后台准备过程，发布前请再次确认演员肖像授权与字幕校对。演出团队确认素材授权；镜头包含后台准备过程，发布前请再次确认演员肖像授权与字幕校对。演出团队确认素材授权；镜头包含后台准备过程，发布前请再次确认演员肖像授权与字幕校对。演出团队确认素材授权；镜头包含后台准备过程，发布前请再次确认演员肖像授权与字幕校对。演出团队确认素材授权；镜头包含后台准备过程，发布前请再次确认演员肖像授权与字幕校对。演出团队确认素材授权；镜头包含后台准备过程，发布前请再次确认演员肖像授权与字幕校对。演出团队确认素材授权；镜头包含后台准备过程，发布前请再次确认演员肖像授权与字幕校对。演出团队确认素材授权；镜头包含后台准备过程，发布前请再次确认演员肖像授权与字幕校对。演出团队确认素材授权；镜头包含后台准备过程，发布前请再次确认演员肖像授权与字幕校对。演出团队确认素材授权；镜头包含后台准备过程，发布前请再次确认演员肖像授权与字幕校对。演出团队确认素材授权；镜头包含后台准备过程，发布前请再次确认演员肖像授权与字幕校对。演出团队确认素材授权；镜头包含后台准备过程，发布前请再次确认演员肖像授权与字幕校对。演出团队确认素材授权；镜头包含后台准备过程，发布前请再次确认演员肖像授权与字幕校对。演出团队确认素材授权；镜头包含后台准备过程，发布前请再次确认演员肖像授权与字幕校对。演出团队确认素材授权；镜头包含后台准备过程，发布前请再次确认演员肖像授权与字幕校对。演出团队确认素材授权；镜头包含后台准备过程，发布前请再次确认演员肖像授权与字幕校对。演出团队确认素材授权；镜头包含后台准备过程，发布前请再次确认演员肖像授权与字幕校对。演出团队确认素材授权；镜头包含后台准备过程，发布前请再次确认演员肖像授权与字幕校对。"
    },
    {
      "id": "81d541f7-6cf5-5352-ac4d-37bbdd26c7ff",
      "team_id": 3,
      "title": "后台候场时听见的锣鼓点｜长生殿·惊变沉浸演出",
      "category": "幕后记录",
      "platform": "微信视频号",
      "published_at": "2026-10-14T19:30:00",
      "duration": 48,
      "views": 0,
      "likes": 0,
      "comments": 0,
      "saves": 0,
      "shares": 0,
      "completion": 0,
      "lifecycle": "未发布",
      "workflow_state": "待制作",
      "performance_id": "c5e1b138-7096-59e2-a0db-1b92f85f9c41",
      "owner_email": "qinglan@songfeng.example",
      "tags": [
        "排练",
        "锣鼓"
      ],
      "materials": "",
      "cover_url": "example/covers/arts-3.jpg",
      "notes": ""
    },
    {
      "id": "3083ca01-73a0-5e32-97c5-32a0d16d8987",
      "team_id": 1,
      "title": "第一次听昆曲，先认出这三个身段｜牡丹亭·游园秋日专场",
      "category": "艺术科普",
      "platform": "B站",
      "published_at": "2026-10-15T19:30:00",
      "duration": 55,
      "views": 0,
      "likes": 0,
      "comments": 0,
      "saves": 0,
      "shares": 0,
      "completion": 0,
      "lifecycle": "未发布",
      "workflow_state": "待制作",
      "performance_id": "762e8d66-b228-5282-a757-16a0b58fbcd1",
      "owner_email": "zhixia@yunxi.example",
      "tags": [],
      "materials": "",
      "cover_url": "example/covers/arts-4.jpg",
      "notes": ""
    },
    {
      "id": "d4fdee4f-60ee-5d70-964c-ac18fac9a66d",
      "team_id": 2,
      "title": "十八相送里最轻的一句唱词｜梁祝·十八相送青年版",
      "category": "演出宣传",
      "platform": "抖音",
      "published_at": "2026-10-16T19:30:00",
      "duration": 62,
      "views": 0,
      "likes": 0,
      "comments": 0,
      "saves": 0,
      "shares": 0,
      "completion": 0,
      "lifecycle": "未发布",
      "workflow_state": "待制作",
      "performance_id": "4c667491-4d6a-55db-b04b-d40cbc37b86a",
      "owner_email": "nanyin@haitang.example",
      "tags": [
        "越剧",
        "青年演员"
      ],
      "materials": "灯光定妆照、后台花絮短片、演员授权肖像素材",
      "cover_url": "example/covers/arts-5.jpg",
      "notes": ""
    },
    {
      "id": "190195e3-37b4-505a-a3ec-674b728fe7bd",
      "team_id": 3,
      "title": "一段越剧水袖的呼吸节奏｜长生殿·惊变沉浸演出",
      "category": "技艺展示",
      "platform": "小红书",
      "published_at": "2026-10-17T19:30:00",
      "duration": 69,
      "views": 0,
      "likes": 0,
      "comments": 0,
      "saves": 0,
      "shares": 0,
      "completion": 0,
      "lifecycle": "未发布",
      "workflow_state": "待制作",
      "performance_id": "c5e1b138-7096-59e2-a0db-1b92f85f9c41",
      "owner_email": "yuebai@songfeng.example",
      "tags": [
        "水袖",
        "新Tag-梨园观察"
      ],
      "materials": "",
      "cover_url": "example/covers/arts-6.jpg",
      "notes": ""
    },
    {
      "id": "f0274af7-12bb-59dd-b4cc-091101a7dedf",
      "team_id": 1,
      "title": "台前三分钟与台后三小时｜牡丹亭·游园秋日专场",
      "category": "幕后记录",
      "platform": "微信视频号",
      "published_at": "2026-10-18T19:30:00",
      "duration": 76,
      "views": 0,
      "likes": 0,
      "comments": 0,
      "saves": 0,
      "shares": 0,
      "completion": 0,
      "lifecycle": "未发布",
      "workflow_state": "待制作",
      "performance_id": "762e8d66-b228-5282-a757-16a0b58fbcd1",
      "owner_email": "qinghe@yunxi.example",
      "tags": [
        "后台",
        "演出日常",
        "舞台日记"
      ],
      "materials": "",
      "cover_url": "example/covers/arts-1.jpg",
      "notes": ""
    },
    {
      "id": "c0afeaca-eb3c-50a1-aeeb-6b5502324349",
      "team_id": 2,
      "title": "从排练厅到剧场的灯光变化｜梁祝·十八相送青年版",
      "category": "艺术科普",
      "platform": "B站",
      "published_at": "2026-10-19T19:30:00",
      "duration": 83,
      "views": 0,
      "likes": 0,
      "comments": 0,
      "saves": 0,
      "shares": 0,
      "completion": 0,